<?xml version="1.0" encoding="UTF-8"?>
<xs:schema xmlns:xs="http://www.w3.org/2001/XMLSchema">

    <xs:element name="Company">
        <xs:complexType>
            <xs:sequence>
                <xs:element name="Employee">
                    <xs:complexType>
                        <xs:sequence>
                            <xs:element name="FirstName" type="xs:string"/>
                            <xs:element name="LastName" type="xs:string"/>
                            <xs:element name="ContactNo" type="xs:string"/>
                            <xs:element name="Email" type="xs:string"/>
                            <xs:element name="Address">
                                <xs:complexType>
                                    <xs:sequence>
                                        <xs:element name="City" type="xs:string"/>
                                        <xs:element name="State" type="xs:string"/>
                                        <xs:element name="Zip" type="xs:int"/>
                                    </xs:sequence>
                                </xs:complexType>
                            </xs:element>
                        </xs:sequence>

                        <!-- Attribute -->
                        <xs:attribute name="empId" type="xs:string" use="required"/>
                    </xs:complexType>
                </xs:element>
            </xs:sequence>

            <!-- Attribute -->
            <xs:attribute name="companyId" type="xs:string" use="required"/>
        </xs:complexType>
    </xs:element>

</xs:schema>
